,name,url
0,Massolo Calzature Di Massolo Carlo E Carmelina S.n.c.,https://www.ufficiocamerale.it/7401/massolo-calzature-di-massolo-carlo-e-carmelina-snc
1,Alexandria Spa,https://baliansprings.com/
2,Tecno Gi Spa,https://www.tecnogi.com/en/
3,Visconti Pio Srl,https://www.viscontisrl.com/en/home-en/
4,Tomaificio Fontaneto Daniela E Stefano Snc,https://www.misterimprese.it/marche/pesaro-e-urbino/fano/calzature-produzione-e-vendita-ingrosso/1157936.html
5,Maxxel Srl,https://www.listafirme.ro/maxxel-srl-14535284/
6,Dal-car S.d.f. Di Di Francesco Antonio E Dalmas Giuseppe,https://www.informazione-aziende.it/Azienda_DAL-CAR-SDF-DI-DI-FRANCESCO-ANTONIO-E-DALMAS-GIUSEPPE
7,Calzaturificio Alexandria Srl,https://www.ufficiocamerale.it/1993/calzaturificio-alexandria-srl
8,Casarotti Calzature Di Gattoni Giampaolo,https://casarotticalzature.it/
9,Ghidoni Sport S.n.c. Di Bellotti Maria Teresa E C.,https://www.dnb.com/business-directory/company-profiles.bellotti_sport_di_bellotti_paolo_e_c_-_snc.369d6c5b51c805d1a54152844fc4b8e4.html
10,Plumy Srl,https://www.plumy.it/en/home-en/
11,Isocal Srl,https://www.dnb.com/business-directory/company-profiles.isocal_srl.82a571517b51a4ef30d7aafb6fbf24ed.html
12,Gifra Srl,https://www.gifrasrl.it/
13,Brecal Srl,https://www.dnb.com/business-directory/company-profiles.brecal_contratistas_generales_srl.137cc453d8033e86ff99096812467159.html
14,Power Brand Collezioni Italiane Srl,https://www.coobiz.it/azienda/vigevano-attivita-produzione/co1632464
15,Emmeci Tecno Foot Di Morosoli Giancarlo E Gardini Luigia S.n.c.,https://www.emmeci.it/
16,Ash Europa Srl,https://asheuropa.com/
17,Calzaturificio Angelo Coppola Srl,https://www.coppolacalzaturificio.com/
18,Pianellificio Jessica Sas Di Treccani Agnese & C.,https://www.dnb.com/business-directory/company-profiles.magini_agnese__c_sas_di_flacca_silvia.6fe4655e5df6f906d8bb14d8f04ca21a.html
19,Parabiago Collezioni Srl,https://www.thierryrabotin.com/
20,Alessandro Ticozzi & C Sas,https://www.marketscreener.com/insider/ALESSANDRO-TICOZZI-A2AI18/
21,Mec Europa Srl,https://www.meceuropadue.com/
22,Creazioni D'acci Snc Di D'acci Antonio & C,https://www.ilmessaggero.it/abruzzo/macchinista_eroe_antonio_d_acci_chi_e_cosa_ha_fatto-8021147.html
23,Cooperativa S.r.l. Pantofolificio Dora,https://www.dnb.com/business-directory/company-profiles.cooperativa_srl_pantofolificio_dora.3edaa9f70d5d1524a5d14d0a4d2e9f9e.html
24,Calzaturificio Fratelli Zaniboni Di Fausto Donato Zaniboni E C Snc,https://www.facebook.com/calzaturificiofaustozaniboni/
25,Mef Di Migliorati Eugenio Franco & C. Snc,https://www.coobiz.it/azienda/verolanuova-produzione-puntali/co1625297
26,Calzaturificio Brivio Di Dulio Francesca E C. - Societa' In Accomandita Semplice .,https://www.dnb.com/business-directory/company-profiles.calzaturificio_brivio_di_dulio_francesca_e_c_sas_.657cd7f33fea6a0dbadb39c3ff40b95d.html
27,Albertini Walter Modellista,https://en.wikipedia.org/wiki/Walter_Albini
28,Pantofolificio Rodes Di De Servi Elio & Zanoli Esterina S.n.c.,https://www.dnb.com/business-directory/company-profiles.pantofolificio_koala_snc_di_ceccato_stefano__c.8336297013b078eb65ecf82d90e679f5.html
29,Dafra S.n.c. Di Specia & Gussoni,https://www.dafra.si/en/about-us/
30,Guardolificio Universale Srl,https://www.dnb.com/business-directory/company-profiles.guardolificio_universale_20_srls.99b8f340ddd5348439483bdf456abba8.html
31,Calzaturificio Monica Di Magnabosco Guerrino & Ramelli Silvana Snc,https://www.dnb.com/business-directory/company-profiles.calzaturificio_monica_di_magnabosco_guerrino__ramelli_silvana_snc.f29c6932d26fabed5dc982765b0d4455.html
32,David Team Di Cogliati Stefano E C. - Societa' In Accomandita Semplice,https://www.youtube.com/watch?v=ZtGAOQMI1wU
33,Fustellexpress S.a.s. Di Gallo Michele & C.,https://italy.globaldatabase.com/company/fustellexpress-s-a-s-di-gallo-michele-c
34,Tacchificio Orri Di Baldissera Osvaldo E Mauro Snc,http://www.tacchificioorri.it/
35,Calzaturificio Bollati Di Giancarlo Bollati E C Sas,https://www.coobiz.it/azienda/parabiago-fabbricazione-commercio/co1629438
36,Sughermec Snc Di Sorrentino Marcello & C.,https://www.dnb.com/business-directory/company-profiles.sughermec_snc_di_sorrentino_marcello__c.9fd3c7465f5617da604e9260afdb538d.html
37,Arianna Di De Micheli Alberto & C. Sas,https://www.facebook.com/public/Arianna-De-Micheli/
38,Tomaificio Ricamificio Giotto S R L,https://www.dnb.com/business-directory/company-profiles.tomaificio_ricamificio_giotto_s_r_l.8d66816d92f5d56089e515521f056774.html
39,Calzaturificio Sultana Di De Vincenzi Renato & C. Sas,https://sultana1962.com/
40,Manifattura Ambrosiana Srl,https://www.dnb.com/business-directory/company-profiles.manifattura_ambrosiana_srl.4d808a3d4e5c1972c57d4e65e5a1caec.html
41,Cutrona Carmelo E C. Snc,https://www.europages.co.uk/CUTRONA-CARMELO-C-SNC/SEAC000132815-001.html
42,Calzaturificio Valentina S.r.l.,https://www.facebook.com/calzaturificiovalentina/
43,Sander Shoes S.r.l.,https://www.sanders-uk.com/
44,Tandem Di Renzi E C. S.n.c.,https://opencorpdata.com/lei/815600E106B2E3F87602
45,Company Shoes Di Tirelli Luigi Giuseppe & C.snc,https://www.dnb.com/business-directory/company-profiles.flli_tirelli_di_tirelli_giuseppe_e_tirelli_gianpiero_snc.c7c359a2bdad9fef50c7015acb185b55.html
46,Tranceria Bresciana Di Gandelli Roberto E C. S.n.c.,https://www.reteimprese.it/calzaturifici-calzolai-forniture/verolavecchia/azienda/433482
47,Pantofolificio Fulvia Di Picone E Renna Sdf,https://www.dnb.com/business-directory/company-profiles.pantofolificio_fulvia_di_picone_e_renna_sdf.3b3fb87128416b6c1908d85ca21fa061.html
48,Pantofolificio Duomo Di Franchini Sergio,https://en.wikipedia.org/wiki/Sergio_Franchi
49,Gi - Erre Di Zampini Gianna Maria,http://www.gi-erre.com/en/company/history/
50,Claudio Merazzi Srl,https://it.linkedin.com/in/claudio-merazzi-0984ab52
51,Calzaturificio Di Vigevano Srl,https://sultana1962.com/
52,Tomaificio Marie Ann Di Dara Franco E C Snc,https://www.dnb.com/business-directory/company-profiles.tomaificio_altog_di_dalessandro_paolo__c_snc.1ef818904ca57091e7ebb536c96d1e3d.html
53,Rcf Group Sas Di Pisu Rinaldo & C.,https://rcf-group.it/en/chi-siamo/
54,Tiemmedi Di Torri Battista E Luigi Snc,https://m.tiemme.com/chi_siamo_pagina-det_10.php
55,Belloni Sport Snc Di Belloni Giuseppe E C,https://www.dnb.com/business-directory/company-profiles.belloni_sport_sas_di_belloni_roberto_e_c.801f7ee7361c819ef235ac62e42672aa.html
56,Pantofolificio Edda Di Tognon Luigi & C. Snc,https://www.misterimprese.it/lombardia/milano/castano-primo/calzature-produzione-e-vendita-ingrosso/336818.html
57,Madial S N C Di Gilardi Enrichetta E Marinoni Celeste,https://italy.globaldatabase.com/company/madial-s-n-c-di-gilardi-enrichetta-e-marinoni-celeste
58,Calzaturificio Romagnoli Di Romagnoli Graziella,https://romagnoli.com/
59,Verdi Fashion Srl,http://www.verdi-italy.com/
60,Bubamara Di Ziglioli Agostino,https://franoi.com/food/agostinos-closes-its-doors-after-38-years/
61,Bandera Giovanni,https://pglex.it/professionisti/giovanni-bandera/
62,Milk Snc Di Cinzia Tantardini E C,https://www.dnb.com/business-directory/company-profiles.milk_snc_di_cinzia_tantardini_e_c.2579b8a862a97611d5690e593e4d5fd2.html
63,Tomaificio Luna Sas Di Salandra Rosaria E C .,https://www.dnb.com/business-directory/company-profiles.tomaificio_luna_sas_di_salandra_rosaria_e_c.2706b31cb9f2209dd6a4a3fdf282e1c4.html
64,Pantofolificio Marina Di Comini Luciano & C. S.n.c.,https://italialei.it/informazioni-dettagliate/34270593/pantofolificio-marina-di-comini-luciano-e-c-snc/
65,C.s.l. Di Carminati Clodoveo E C. Snc,https://local.italy724.info/en/csl-di-carminati-clodoveo-e-c-snc-39-0331-440340.html
66,I Pugliesi Di Marcone Maria Luigia E Paganelli Vincenzo Snc,https://www.necrologiweb.it/necrologio/19736/vincenzo-paganelli-vice-brigadiere-dell-arma-dei-carabinieri
67,Cavestro Antonio Gabriele S.r.l.,https://www.linkedin.com/pub/dir/Gabriele/Cavestro
68,Marel Srl,https://marel.com/en/
69,Calzaturificio Fratelli Rosana Srl,https://www.dnb.com/business-directory/company-profiles.calzaturificio_fratelli_rosana_srl.fbd6118af5900b02eec8e48ff49cb97c.html
70,Sirio Srl,https://www.siriofirenze.com/?lang=en
71,Mito Calzature Srl,https://www.facebook.com/MitoCalzature/
72,Tomaificio Carla Di Necchi Mario E Brigato Claudia & C. S.a.s.,https://www.impresaitalia.info/mstdb80708017/tomaificio-carla-di-necchi-mario-e-brigato-claudia-e-c-sas/vigevano.aspx
73,Tomaificio Zumelli S.n.c. Di Zumelli Dania E C.,https://italy.globaldatabase.com/company/tomaificio-zumelli-s-n-c-di-zumelli-dania-e-c
74,Pantofolificio Ge-da Di Soave Gianfranco,https://www.dnb.com/business-directory/company-profiles.pantofolificio_ge_da_di_soave_gianfranco.177e1bd3f084420bc759c9cf70ab1458.html
75,Pantofolificio Gorlese S.n.c. Di Colombo Giovanni E Colombo Cesare,https://ambriola.com/giovanni-colombo/
76,"Donadoni E Colombo Sas Di Donadoni Claudio, Colombo Anselmo & C. C",https://www.notiziarioaraldico.info/2019090614824/un-libro-sui-donadoni/
77,Erman S.n.c. Di Erculiani Franco,https://www.visura.pro/imprese/3848368161-erman-snc-di-erculiani-franco.html
78,Maxima 1967 Srl,https://www.maximaonline.it/en/home-2/
79,Mary Shoes Di Di Natale Giacomo S.n.c.,https://anamericaninrome.com/2019/06/di-san-giacomo-handmade-sandals-in-rome/
80,Futura Di Zampieri Anna & C. S.a.s.,https://www.dnb.com/business-directory/company-profiles.futura_snc_di_dainese_giorgio_e_zampieri_anna.32bb403c709f5e287fa16e5cabde1e49.html
81,Giune S.a.s. Di Re Matteo & C.,https://www.giune.it/en/about-us/
82,Crb Calzaturifici Riuniti Bustesi S.r.l.,https://www.crb-italy.it/
83,Barzaghi Snc Di F.lli Alberto E Gianfranco,https://local.italy724.info/en/barzaghi-snc-di-flli-alberto-e-gianfranco-39-0362-851207.html
84,L.c.f. Di Battiani Luciano & C. - S.n.c.,https://www.dechecchiluciano.it/
85,Mauri Shoes Srl,http://www.maurishoes.com/
86,Calzaturificio Ester Srl,http://calzaturificioester.it/
87,Zuber Snc Di Zuber Walter & C.,https://www.higginsmemorialhome.com/obituaries/Walter-J-Zuber?obId=27954899
88,Calzaturificio Alida Srl,https://www.dnb.com/business-directory/company-profiles.calzaturificio_alida_srl.7fe1cbf0234705a0e3974f0ed7efb5f5.html
89,Venti Srl,https://www.ventisrl.it/
90,U S S Safety System Srl,https://safetystage.com/fall-protection/self-retracting-lifeline-inspection-requirements/
91,Italmart Srl,https://www.dnb.com/business-directory/company-profiles.ital_mart_srl.1fcecc00381cbd596384d3da1c1bd04f.html
92,Calzaturificio Zilio Snc Di Zilio Roberto E Stefano,https://www.paginebianche.it/saonara/calzaturificio-zilio-zilio-roberto-stefano.7150908
93,Calzaturificio Taurus Di De Gaspari Gino,https://www.calzaturificio-taurus.it/azienda.php
94,Calzaturificio Josert Sas Di Tosato Fernanda & C.,https://www.coobiz.it/azienda/saonara-produzione-calzature/co1630760
95,Mytym Srl,https://www.creditsafe.com/business-index/en-gb/company/mytym-srl-it04151028
96,Alpi Trek Srl,https://prosafety.com/en/safety-s3/4106-visibly-safety-shoes-s3-src--trek-alpi.html
97,Silni Sport Srl,https://www.ufficiocamerale.it/4722/silni-sport-srl
98,Jolly Scarpe Spa,https://www.jollyscarpe.com/
99,Tomaificio Fusion Sas Di Bertollo Francesco,https://www.impresaitalia.info/mstdb80124533/tomaificio-fusion-sas-di-bertollo-francesco/pianezze.aspx
100,Tecno Riba Di Barbato Giampietro E Rizzato Oriana S.n.c.,https://reportazienda.it/aziende/PD/tecno-riba-di-barbato-giampietro-e-rizzato-oriana-snc-196962
101,S.a.c. Snc Di Benetti Stefano & C.,https://www.dnb.com/business-directory/company-profiles.sac_snc_di_benetti_stefano__c.4ff04e352107bfbe833cc21229988481.html
102,Zampieri S.r.l.,https://zampiericucine.it/en/
103,Fac Sas Di Leonardo Callegaro E C.,https://www.dnb.com/business-directory/company-profiles.fac_sas_di_leonardo_callegaro_e_c.8dc7614e1a3dbdd44d68b97152062675.html
104,Corinne Sas Di Baldan Antonio & C,https://www.axios.com/local/san-antonio/2024/02/23/corinne-san-antonio-plaza-hotel
105,Tre Bi Snc Di Botter Bruno & C.,https://www.misterimprese.it/veneto/treviso/cornuda/calzature-produzione-e-vendita-ingrosso/788572.html
106,Sarp Di Savietto Rita & C. S.n.c.,https://www.ufficiocamerale.it/6749/sarp-di-savietto-rita-c-snc
107,Mavolma Sas Di Mazzarolo Sante & C.,https://www.dnb.com/business-directory/company-profiles.mavolma_sas_di_mazzarolo_giovanni__c.a38c76f8e80002f7ba3341a6000fc745.html
108,Tacchificio Marco Di Fanton Vittorina & Figli Snc,https://www.oraridiapertura24.it/filiale/Stra%27-Tacchificio%20Marco%20Di%20Fanton%20Vittorina%20%26%20Figli%20Snc-2839723U.html
109,Calzaturificio Roberta Di Stragliotto Giovanni E Stragliotto Bruno Snc,https://www.dnb.com/business-directory/company-profiles.calzaturificio_roberta_di_stragliotto_giovanni_e_stragliotto_bruno_snc.dbdea29332e19a170959ba55b88efd97.html
110,Sociart Srl,https://www.facebook.com/sociart.agency/
111,Comunello Matteo,https://www.facebook.com/people/Comunello-Matteo/100063774541933/
112,Calzaturificio Altinea Di Salmaso Luigi E Alberto E C. S.n.c.,https://www.youtube.com/watch?v=2pV3AUOXRfE
113,Due Effe Di Ferraresso Redento E C. S.n.c.,https://www.dueffe.com/chi-siamo/
114,Tomaificio Artigiano Di Trolese Franca E C. S.a.s.,https://www.tomaificioas.it/
115,Due F Di Ferraresso Mauro E Loris S.n.c.,https://www.dnb.com/business-directory/company-profiles.due_f_di_ferraresso_mauro.a94a6bef44d0cd428f4df7011fb98605.html
116,Tranceria Stilmode Di Bugin Denis & C. Sas,https://shop.stilmoda.it/
117,Tranceria Venezia S.n.c. Di Massaro Luca & C.,https://www.eccellenzeitaliane.com/aziende/tranceria-venezia-snc-di-massaro-luca-e-c/3096446
118,Parimm Spa,https://www.booking.com/spa/city/ee/parnu.et.html
119,Duegi Snc Di Cisamolo Giuseppe E Totolo Giovanna,https://www.duegi-snc.it/
120,Ten.fra. S.a.s. Di Franzini Nicola & C.,https://atoka.io/public/it/azienda/tenfra-sas-di-franzini-nicola-c/e35f5edf5e7f
121,Simionato Sonia,https://www.facebook.com/sonia.simionato/
122,D.b. Assemblaggi Di Bortolamiol Daniela,https://italialei.it/informazioni-dettagliate/33080422/db-assemblaggi-di-bortolamiol-daniela/
123,Nord Shoe's Sas Di Gajo Onorato & C.,https://www.misterimprese.it/veneto/treviso/caerano-di-san-marco/calzature-vendita-al-dettaglio/780521.html
124,Tomaificio Botter Bruno & C. Snc,https://www.bloomberg.com/profile/company/5594797Z:IM
125,Deon Egidio,https://www.textileinfomedia.com/business-info/Deon-Egidio
126,Fra.mar. - Societa' A Responsabilita' Limitata - In Sigla - Fra.mar. S.r.l.,https://www.reportaziende.it/framar_societa_e_a_responsabilita_e_limitata_in_sigla_framar_srl_ve_02690240276
127,Calzaturificio Elisa S.r.l.,https://elisabet.it/
128,Solettificio Emmepi Snc Di Pavanello Giampietro & C.,https://www.cylex-italia.it/vigonovo-vigonovo/solettificio-emmepi-di-pavanello-giampietro---c--s-n-c--6777478.html
129,Prexport S.r.l.,https://www.prexport.com/en/home-en/
130,Calzaturificio Padana Di Agostini F. E C. Snc,https://www.impresaitalia.info/mstdb80397650/calzaturificio-padana-di-agostini-f-e-c-snc/vigonza.aspx
131,Noelanj S.r.l.,https://us.nolan.it/us
132,4 R Di Righetto Renzo E C. Snc,http://www.rerrettifiche.it/
133,Original Sergio Salmaso Srl,https://salmasovenezia.it/index_it.html
134,Adriatica Suole Srl,http://www.faitadriatica.it/
135,Ditta Tronchin Silvio,https://www.tronchin.it/servizi
136,Calzaturificio Martin S.a.s. Di Montesso Silvio & C.,https://www.sanmartincalzaturificio.com/content/20-brand-san-martin
137,Calzaturificio Mary Di Fasoli Angelo,https://www.calzaturedesigned.com/
138,Tullio Sport S.n.c. Di Dal Bello Tullio & C.,https://www.informazione-aziende.it/Azienda_TULLIO-SPORT-SNC-DI-DAL-BELLO-TULLIO-C
139,Damer Sport Di Merotto Diego,https://www.yelp.com/biz/damer-sport-di-merotto-diego-montebelluna
140,Pravato Gianni,https://www.facebook.com/public/Gianni-Pravato/
141,G.m.b. Snc Di Gastaldello Benvenuto E C.,https://www.dnb.com/business-directory/company-profiles.gmb_arte_veneta_snc_di_gastaldello_benvenuto.757adb432b6f2e137859ad0c27306a8c.html
142,Tacchificio Cristina Di Bettin Otello E C. Snc,https://tacchificiocristina.it/
143,Calzaturificio Dibal Di Ballin Raffaella & C. Snc,https://www.laconceria.it/calzatura/riviera-del-brenta-fallisce-il-calzaturificio-ballin-franco/
144,Calzaturificio Tre Emme Snc Di Merlo Lino & C.,http://www.treemmecalzature.com/
145,Tacchificio Bordin Snc Di Bordin Cristina E C.,https://tacchificiocristina.it/
146,Logan Spa,https://www.theloganhotel.com/spa-wellness
147,Ennesport Srl,https://www.linkedin.com/company/ennesport-srl
148,T.a.b. Srl,https://www.dnb.com/business-directory/company-profiles.taab_srl.97d50924a4a3fd3d07ba59175b3e7eea.html
149,Eurosolnova Srl,https://www.dnb.com/business-directory/company-profiles.eurosolnova_srl.e1fc5a2b9e7d759477012a81c3bb1829.html
150,Robert Production Di Fasolo Roberto,https://www.robertodipaolo.com/en/
151,Calzalegno Srl,https://www.dnb.com/business-directory/company-profiles.calcagno_srl.d09563a9152871d9a53d5552c1220e18.html
152,Calzaturificio Diotto Di Quagliotto Claudio & C. S.a.s.,https://www.yelp.com/biz/calzaturificio-diotto-di-quagliotto-claudio-and-c-sas-maser
153,D.b. & Graphic Snc Di Sabrina Maschio E C,https://www.impresaitalia.info/mstdb80566002/db-e-graphic-snc-di-sabrina-maschio-e-c/noventa-padovana.aspx
154,Azzurra Suole Di Scanferla Ferdinando,https://www.ivolleymagazine.it/2023/09/05/pallavolo-eurovolley2023-leonardo-scanferla-e-un-sogno-vedere-i-palazzetti-pieni-ci-da-la-carica-non-vediamo-lora-di-scendere-in-campo/
155,Precoma Ortensio,https://www.facebook.com/people/Ortensio-Precoma/61553899679843/
156,Euroworld Di Tocchetto Fabio & C Sas,https://www.euroworld.it/
157,Calzaturificio Orma Di Martignago Ortensio,https://www.patriziashoes.com/en/the-company/calzaturificio/
158,Calzaturificio Tre C Di Cecchetto Adriano E C. S.a.s.,https://www.qdpnews.it/comuni/cortina-dampezzo/alpinisti-in-difficolta-recuperati-in-tofana-con-elicottero-e-due-verricelli/
159,Calzaturificio 2001 - S.n.c. Di Fantinato & C.,https://www.dnb.com/business-directory/company-profiles.calzaturificio_2001_srl.4c790a60b3394b55bcca1762b881e876.html
160,Tomaificio Darin S.n.c. Di Dal Zovo Rino E C.,https://aziende.verona.it/attivita-manifatturiere/fabbricazione-di-calzature/
161,Giunteria Hellas Di Cristini Marco Antonio E C. S.n.c.,https://www.coobiz.it/azienda/rivoli-veronese-sede/sede/1634632
162,Ricamificio Ilarione Di Righetto Giovanni E C. S.n.c.,https://everestricami.it/
163,Sueva S.n.c. Di Evaledi Tiziana & Chiovetto Franca,https://www.impresaitalia.info/mstdb80587301/sueva-snc-di-evaledi-tiziana-e-chiovetto-franca/ronco-all-adige.aspx
164,Tagliatura Ti Emme Di Marcazzan Claudio E Zambon Aldo S.n.c.,https://aziende.verona.it/attivita-manifatturiere/fabbricazione-di-calzature/
165,Calzaturificio B.m. Di Burlo Daniele E C. Snc,https://www.ufficiocamerale.it/2868/calzaturificio-bm-di-burlo-daniele-e-c-snc
166,Calzaturificio Civetta Snc Di Zambon Mario & C.,https://www.dnb.com/business-directory/company-profiles.calzaturificio_pienne_di_giunti_mario_e_c_snc.13f3a1df7895c96f74e6577aeadd2bcd.html
167,Euroglobe Srl,https://www.dnb.com/business-directory/company-profiles.euroglobe_home_design_srl.ed79b94f384ca401f31cb3faae25050f.html
168,Calzaturificio Brera S.r.l.,https://www.cylex-italia.it/fosso/calzaturificio-brera-s-r-l--11185991.html
169,Taglio Pellami S.a.s. Di Callegaro Paride,https://reportazienda.it/aziende/VE/taglio-pellami-sas-di-callegaro-paride-242247
170,Tranceria Effe & Erre S.n.c. Di Gottardo Flavio & Renato,https://www.trancefferre.com/
171,Max - Angel S.a.s. Di Gallo Max & C.,https://www.dnb.com/business-directory/company-profiles.max_-_angel_sas_di_gallo_max__c.79cac0d949bd0f170ce92c8d585b3c36.html
172,Serafino S.n.c. Di Serafin Aldo & Rossi Fernanda,https://www.paginebianche.it/mestre/serafino-serafin-aldo-rossi-fernanda.11618410
173,Futura S.n.c. Di Boscaro Graziella,https://www.impresaitalia.info/mstdb80631964/futura-snc-di-boscaro-graziella/mirano.aspx
174,Immobiliare Bruna S.n.c. Di Bruna Pagnin & C.,https://www.dnb.com/business-directory/company-profiles.immobiliare_bruna_snc_di_bruna_pagnin__c.c62c7c6c967d23c43b0d87876bc90a45.html
175,F.lli Ferro Di Ferro Roberto E C. Snc,https://www.lamolisana.it/chi-siamo/spirito-tenace-una-storia-di-famiglia/la-nostra-storia/
176,F.lli Malin Silvio E Renzo Alfonso S.n.c.,https://www.fratellimalin.com/
177,Handy Sas Di Pasqualotto Lorena & C.,https://www.facebook.com/people/Climatec-sas-di-Pasqualotto-Gimmy-C/100063466451000/
178,Fioratti Loris & C. S.d.f.,https://www.dnb.com/business-directory/company-profiles.fioratti_loris__c_sdf.2f2072f412e70ff8a8df819616f8fe92.html
179,Effe - Erre S.n.c. Di Anselmi Flavia E Anselmi Rosanna,https://www.effe-erre.com/en/
180,Emmezeta Di Milani Francesco E C. S.a.s.,https://emmezeta.it/azienda/
181,Sildar S.n.c. Di Bernini Mirella E Martini Silvano,https://www.impresaitalia.info/mstdb80654837/sildar-snc-di-bernini-mirella-e-martini-silvano/zevio.aspx
182,Tomaificio Nadia S.n.c. Di Guerra Nadia & C.,https://italy.globaldatabase.com/company/tomaificio-nadia-s-n-c-di-guerra-nadia-c
183,Calzaturificio Celin Di Celin Angelo,https://www.dnb.com/business-directory/company-profiles.calzaturificio_celin_snc_di_celin_federico_e_michele_e_c.4b1233e1f95bc1dfa92e28a76b18281b.html
184,Levorato Alessio Sas & C.,https://www.levoratoitalia.com/en/company/
185,Calzaturificio B.m. Moda Di Ballin F. & C Sas,http://www.ballin-shoes.it/it/index.html
186,La Fenice Di Campice Ennia & C. Sas,https://www.dnb.com/business-directory/company-profiles.la_fenice_sas_di_russo_vincenzo__c.1a99ab9c3f5037e4fe3b70af76858852.html
187,Immobiliare Clara Di Luciano Giantin E C. Snc,https://it.nextdoor.com/pages/immobiliare-clara-di-luciano-giantin-e-c-snc-in-sigla-immobiliare-clara-snc/
188,Mazzarolo Armando Calzaturificio Armond,https://www.armond.com/storia.html
189,Masiero Lorenzo,https://www.lorenzomasiero.it/en/
190,Paolo Zanon S.a.s. Di Zanon Paolo,https://www.bloomberg.com/profile/company/0657678D:IM
191,Gabriella S.n.c. Di Sartore Stefania & Favero Laila,https://www.dnb.com/business-directory/company-profiles.tomaificio_gabriel_snc_di_favero_laila_e_sartore_stefania.f357bbd75aa413a5916fbffbe2ee92a4.html
192,"Tomaificio 3m Di Maschio Maria, Massaro Sonia E Loredana - S.n.c.",https://scholar.google.com/citations?user=vNb9imQAAAAJ
193,Calzaturificio Nadia S.n.c. Di Toffanin Mirko & C.,https://www.misterimprese.it/veneto/padova/saonara/calzature-produzione-e-vendita-ingrosso/892511.html
194,Ti.effe.ci. Snc Di Furlan Luciano & Cappello E. Snc,https://www.dnb.com/business-directory/company-information.lessors_of_real_estate.it.padova.cinto_euganeo.html
195,Calzat Piccole Donne Srl,https://www.florens.it/
196,Tec-up Srl,https://www.tec-up.it/
197,Calzaturificio F.lli Ambrosi Di Ambrosi Fabio E C. S.n.c.,https://www.informazione-aziende.it/Azienda_CALZATURIFICIO-FLLI-AMBROSI-DI-AMBROSI-FABIO-E-C-SNC
198,Nuova Valeria Di Ferraresso Igino & C. - S.n.c.,https://www.coobiz.it/azienda/sant-angelo-di-piove-di-sacco-tranceria-tomaificio/co1630893
199,Giada Snc Di Frassetto Gian Carlo & C.,https://giada-snc.it/
200,Facci F.lli Roberto E Luciano S.n.c.,https://www.dnb.com/business-directory/company-profiles.flli_lanfranchi_di_lanfranchi_roberto_e_luciano_snc.0f298469d3e7fbf9325d0a1a42efe055.html
201,Team Form Srl,https://www.teamform.it/it/home/
202,Simon Sport - S.d.f. Di Simeoni Lina & C.,https://www.simongroupholdings.com/simon-sports
203,Stv S.n.c. Di Morana E. & C.,https://www.stvmachinery.it/company/in-the-world
204,Tranceria Manuel Sas Di Milanese Vinicio E C.,https://www.dnb.com/business-directory/company-profiles.manuel_group_sas_di_milanese_vinicio.d5ae7b7df2bb6ebd64e387f445179d1f.html
205,Millenovecentodieci Srl,https://www.vivino.com/US/en/azienda-vinicola-losito-e-guarini-millenovecentodieci-montepulciano-d-abruzzo/w/9075402
206,Tacchificio Paolo Di Spada Matteo,https://www.paolodimatteo.com/
207,Premiere Srl,https://www.dnb.com/business-directory/company-profiles.premiere_srl.90f0a7c595dc8f1ebf8cd883aeb09c53.html
208,G & G S.r.l.,https://www.g-and-g.it/company/
209,Fashion Planet Di Bagagiolo Maria Fiorella,https://mariafiorello.com/en/
210,Calzaturificio Artigiano Di Tonin Romeo,https://www.dnb.com/business-directory/company-profiles.calzaturificio_artigiano_di_tonin_romeo.ec95ef1ce782bd5304ef080b261e8fda.html
211,Masiero Lorenzo Srl,https://www.lorenzomasiero.it/
212,Ust Srl,https://en.wikipedia.org/wiki/UST_(company)
213,Tomaificio Elisa Di Cabbia Anna Rosa,https://www.coobiz.it/azienda/fiesso-d-artico-tomaificio/co1634300
214,Tomaificio Bordificio Macri Di Gazzea Terenzio,https://www.impresaitalia.info/mstdb81030545/tomaificio-bordificio-macri-di-gazzea-terenzio/fiesso-d-artico.aspx
215,Coccato Maria Assunta,"https://en.wikipedia.org/wiki/Santa_Maria_Assunta,_Ariccia"
216,Suolificio Bezze Srl,https://gb.kompass.com/c/suolificio-bezze-s-r-l/it7043975/
217,Andrew Srl,https://andrewshoes.com/it/
218,Calzaturificio Gaetano Srl,https://www.dnb.com/business-directory/company-profiles.calzaturificio_gaetano_srl.62da7d5681a80ee1656525e68686b9f5.html
219,Solettificio Meneghetti Snc Di Meneghetti Emanuele E Zampieri,http://www.aziendeinrete.it/veneto/venezia/stra/calzaturifici-e-calzolai-forniture/097088071066093096090.html
220,Tranceria Solettificio Livia Di Bonamini Lucia,https://www.yelp.com/biz/tranceria-solettificio-livia-di-bonamini-lucia-isola-rizza
221,Calzaturificio Galar Srl,https://italy.globaldatabase.com/company/calzaturificio-galar-s-r-l
222,Pev S.r.l.,https://www.dnb.com/business-directory/company-profiles.pev_srl.b3fa6448084c69834b5c511066639755.html
223,Tre Ponti - Calzaturificio Ci-zeta Di Cecconato E Zizola - S.n.c.,https://www.ufficiocamerale.it/3437/tre-ponti-calzaturificio-ci-zeta-di-cecconato-e-zizola-snc
224,S. & C. Srl,https://en.wikipedia.org/wiki/Société_à_responsabilité_limitée
225,Ornella Calzature Sas Di Zarpellon Manuel Thomas E C,https://www.ufficiocamerale.it/8544/ornella-calzature-sas-di-zarpellon-thomas-c
